"Fixed_Comment","annotation_id","annotator","created_at","id","lead_time","sentiment","updated_at""thubui 35 Lúc đó Trung_Quốc vừa_mới trải qua ba năm thiên_tai còn có cách_mạng văn_hóa đồng_thời đắc tội với Liên_Xô lúc đó Liên_Xô đã ở biên_giới Trung_Quốc_Trần_Binh 1 triệu quân_đoàn cơ_giới_hóa Trung_Quốc lúc đó vì ứng_phó với Liên_Xô cũng điều_động 2 triệu quân_đội ở khu_vực biên_giới Tóm lại lúc đó Trung_Quốc đang ở vào thời_điểm yếu_ớt nhất thế nhưng lúc này Việt_Nam đã phát_động chiến_tranh với mấy quốc_gia Đông_Nam Á dựa vào lực_lượng chiến_đấu ưu_tú có xu_thế muốn thống_nhất Đông_Nam Á đồng_thời trước khi xung_đột Trung_Việt bùng_nổ quân_đội Việt_Nam đã thường_xuyên phát_sinh tranh_chấp với quân_đội Trung_Quốc ở biên_giới Trung_Quốc thông_qua con đường ngoại_giao phát_biểu nhiều lần kháng_nghị cho nên đây giống như là hai con hổ đang giằng_co Lúc này đột_nhiên xuất_hiện một con hổ tương_đối yếu hơn nữa con này lộ ra răng_nanh là một con hổ muốn trợ_giúp Liên_Xô lúc này Trung_Quốc phải dựa vào sức_mạnh của Mỹ mau_chóng giải_quyết con hổ yếu này để ứng_phó với Liên_Xô_Đây là nguyên_nhân căn_bản của chiến_tranh bùng_nổ lực_lượng quân_sự Việt_Nam lúc bấy_giờ quá mạnh_mẽ nếu để Việt_Nam thống_nhất Đông_Nam Á sau đó Việt_Nam và Liên_Xô sẽ hình_thành xu_thế bao_vây Trung_Quốc đó cũng là lý_do tại_sao Trung_Quốc lúc bấy_giờ sẽ nhanh_chóng chuyển sang vòng_tay của Mỹ bởi_vì Trung_Quốc đã suy_yếu cực_độ không có khả_năng ứng_phó với hai mặt giáp_công Cho_nên lúc đó Đặng Tiểu_Bình quyết_định tiến_hành chiến_tranh trừng_phạt Việt_Nam Buộc Việt_Nam rút quân khỏi phần còn lại của Đông_Nam Á làm gián_đoạn quá_trình thống_nhất Đông_Nam_Á của Việt_Nam tất_nhiên Trung_Quốc đã phải trả một cái giá rất lớn trong cuộc_chiến này",696,"1","2024-12-09T15:11:19.134834Z",694,0.891,"Neutral","2024-12-09T15:11:19.134834Z"
"nếu không có B52 và sự tham_gia của tiêm_kích của hạm_đội 7 cũng như của các căn_cứ tại huế đà_nẵng hạn_chế hơn thì có_thể Khe_Sanh đã thành ĐBP thứ 2 bị tiêu_diệt hoàn_toàn Vô_cùng biết_ơn các bác đã ngã xuống vì độc_lập dân_tộc để chúng cháu có ngày hôm_nay thái_bình tự_do 3",697,"1","2024-12-09T15:11:22.323782Z",695,2.781,"Neutral","2024-12-09T15:11:22.323782Z"
"Cảnh này đã từng xuất_hiện trên phim rồi Xem rất xúc_động",698,"1","2024-12-09T15:11:25.310623Z",696,2.597,"Sad","2024-12-09T15:11:25.310623Z"
"Đúng rồi cả mỹ và phe đồng_minh còn không lại với quân giải_phóng chứ mấy ông ngụy_tham sống sợ chết này thì đánh mấy hồi",699,"1","2024-12-09T15:11:29.509176Z",697,3.773,"Neutral","2024-12-09T15:11:29.509176Z"
"xuống hà_nội thì chắc lại có thêm vài cái gò_đống đa nữa",700,"1","2024-12-09T15:11:31.653461Z",698,1.729,"Neutral","2024-12-09T15:11:31.653461Z"
"Ủa đợt mình lên Tp_Buôn_Mê có cây đa bự chà_bá nằm trong khu quân_đội cấm chụp hình trên đường 30 4 không phải là 3 cây đa đó ak",701,"1","2024-12-09T15:11:33.638001Z",699,1.588,"Neutral","2024-12-09T15:11:33.638001Z"
"2 trận đấy mình buộc phải đánh phải đánh thì mới bắt mỹ_kí hiệp_định để rút quân chứ đánh cả mỹ lẫn vnch thì nó không thắng được mình nhưng mình cungc không ăn nổi",702,"1","2024-12-09T15:11:37.218819Z",700,3.183,"Neutral","2024-12-09T15:11:37.218819Z"
"Đây là loạt bài nhằm cổ suý các thế_hệ trẻ nên lập lại chiến_tích thần_kỳ như đã gom biết_bao của_cải đã cướp được của miền Nam VN từ năm 1975 và của Khơ_Me vào 1977 1978 Miền Bắc của chúng_ta lúc ấy còn nghèo mạt chưa bao_giờ thấy và biết được thế_nào là đời_sống văn_minh Nhờ các cuộc_chiến này con_cháu Đảng mới có được như ngày_nay",703,"1","2024-12-09T15:12:22.566602Z",701,44.926,"Neutral","2024-12-09T15:12:22.566602Z"
"sgblk9661 thế chắc bạn không phải ng VN rồi",704,"1","2024-12-09T15:12:25.095178Z",702,2.12,"Neutral","2024-12-09T15:12:25.095178Z"
"Kiếm đâu đuọc phim này",705,"1","2024-12-09T15:12:26.548903Z",703,1.046,"Neutral","2024-12-09T15:12:26.548903Z"
"tnguyen4928 à là dân phản_diện á hả",706,"1","2024-12-09T15:12:28.359709Z",704,1.407,"Neutral","2024-12-09T15:12:28.359709Z"
"Thực_tế thì có trận nào mà 2 bên không dùng M79 với B41 không nhỉ",707,"1","2024-12-09T15:12:30.289576Z",705,1.501,"Neutral","2024-12-09T15:12:30.289576Z"
"Mình thủ là 1 lợi_thế rồi họ rút quân cũng dễ hiểu mà mục_đích của họ là để VN rút quân từ Campuchia về và họ đã làm được nên rút còn việc đánh chiếm VN mình nghĩ là k vì nếu chiến_tranh với VN chỉ có hại chứ không lợi_lộc gì cố đánh dù được mà thiệt_hại nhiều quá cũng khác gì thua đâu",708,"1","2024-12-09T15:12:35.080185Z",706,4.366,"Neutral","2024-12-09T15:12:35.080185Z"
"Nói_láo không có Nga thì mất Hà_Nội rồi",709,"1","2024-12-09T15:12:37.991122Z",707,2.49,"Neutral","2024-12-09T15:12:37.991122Z"
"toangomo 2 sự đoàn bị xóa sổ là giải_thể sau_này mới khôi_phục lại năm 68 trận khe sanh được coi là dbp thứ 2 nếu thắng sẽ giải_phóng luôn năm 68 nhưng thất_bại các cuộc nổi_dậy chiến_trường miền nam không còn tiếng súng nhưng trận khe sanh vẫn ác_liệt",710,"1","2024-12-09T15:12:47.159770Z",708,8.758,"Proud","2024-12-09T15:12:47.159770Z"
"Mâ_t hay khi chi no i phe t mô t phi_a",711,"1","2024-12-09T15:12:49.394289Z",709,1.82,"Neutral","2024-12-09T15:12:49.394289Z"
"Day dung la mot cuoc noi chien Quan Bac_Viet da xam lang va giet chet toan nguoi VN That dau buon",712,"1","2024-12-09T15:12:52.110336Z",710,2.303,"Neutral","2024-12-09T15:12:52.110336Z"
"Một trong những trận đánh ác_liệt nhất và cũng là 1 trong nhưng nơi máu của người dân Việt_Nam đổ nhiều nhất của cả người Bắc Trung_Nam Cảm_ơn xương_máu các anh_hùng liệt_sĩ",713,"1","2024-12-09T15:12:54.819253Z",711,2.299,"Neutral","2024-12-09T15:12:54.819253Z"
"clown_face clown_face clown_face frog frog frog",714,"1","2024-12-09T15:12:56.284846Z",712,1.058,"Neutral","2024-12-09T15:12:56.284846Z"
"Sự_thật là Trung_Quốc đã học_tập được rất nhiều sau những thiệt_hại nghiêm_trọng trong những ngày đầu của cuộc_chiến và đã nhanh_chóng khắc_phục những yếu_kém của họ và cải_tiến chiến_thuật bằng_chứng là những thiệt_hại to_lớn của bộ_đội Việt_Nam trong những cuộc giao_tranh tại biên_giới phía Bắc đầu những năm 80 đặc_biệt là trận Lão_Sơn Những chi_tiết đó có_thể đọc được qua những bài viết về tướng Hoàng_Đan anh_hùng QĐNDVN Trung_Quốc rất giỏi học_hỏi và cải_tiến tuyệt_đối không_thể khinh_thường",715,"1","2024-12-09T15:12:57.815299Z",713,1.121,"Neutral","2024-12-09T15:12:57.815299Z"
"Sống trong thời_bình khi xem những hình_ảnh này khâm_phục ý_chí chiến_đấu của quân và dân ta lịch_sử nhớ mải công_ơn của các chiến sỷ đã hy_sinh cho dt VN",716,"1","2024-12-09T15:13:01.953708Z",714,3.736,"Neutral","2024-12-09T15:13:01.953708Z"
"Tội_ác của giặc Mỹ giặc đánh thuê và giặc VNCH chỉ có nước biển mới rửa sạch tội của kẻ_thù",717,"1","2024-12-09T15:13:05.220530Z",715,2.855,"Angry","2024-12-09T15:13:05.220530Z"
"Thật tự_hào về Điện_Biên_Phủ Và cũng thật tự_hào cho gia_đình tôi khi Ông Nội tôi đã nằm mãi trên Điện_Biên_Phủ",718,"1","2024-12-09T15:13:07.354122Z",716,1.73,"Proud","2024-12-09T15:13:07.354122Z"
"Người_đời gọi ông là danh_tướng là tướng trận là dũng tướng của những chiến_trường nóng_bỏng còn tôi một người lớp hậu_thế sinh ra không biết mùi bom_đạn chỉ biết đến ông qua các tài_liệu xin được gọi ông là Bất_Bại_Tướng Quân Đại_tướng Lê Trọng Tấn_Sao tôi lại gọi vậy Bởi ông là người cầm_quân có khả_năng xoay_chuyển cục_diện trận đánh trăm trận trăm thắng là con át chủ_bài ở các trận đánh có tính_chất quyết_định Mỗi chiến_dịch do ông chỉ_huy đều là những bản thiên anh_hùng_ca hào tráng Mưu_lược và nghệ_thuật quân_sự_dụng_binh tác_chiến của ông là xuất_thần nhập hoá nghệ_thuật quân_sự của ông đề ra mãi_mãi vẫn là kim chỉ_nam cho quân_đội ta thực_hành tác_chiến đến tận hôm_nay Trận Điện_Biên_Phủ có_thể nói là một trong những trận đánh quy_ước đỉnh_cao nhất trong các trận đánh quy_ước đỉnh_cao tuy_nhiên đây chỉ mới là trận đánh để khẳng_định tên_tuổi của ông Sau_này khi Mỹ đổ quân trực_tiếp tham_chiến những trận hiệp_đồng quân binh_chủng hiệp thành đỉnh_cao nhất tinh_tuý nhất góp_phần rất lớn trong công_cuộc thống_nhất đất_nước đã được vị Đại_tướng này chắp_cánh với tất_cả tinh_hoa của một bậc kỳ_tài Mậu Thân_Trị Thiên_Hạ_Lào Huế Đà_Nẵng chiến_dịch Hồ_Chí_Minh Không một chiến_dịch nào mà không để lại dấu_ấn của ông Trận Huế Đà_Nẵng là một trong những trận đánh mang tầm_vóc chiến_lược đây là trận đánh có tính_chất quyết_định mà Đại_tướng Võ_Nguyên Giáp chỉ cho phép ông đánh trong 3 ngày không chậm mất thời_cơ trong khi đó binh_lực của quân Nguỵ bố_trí ở đây là các lực_lượng tinh_nhuệ nhất Tuy_nhiên khó_khăn chồng_chất khó_khăn thì lại càng khẳng_định được tài thao_lược của Lê Trọng Tấn là đỉnh_cao đến mức nào Trong 3 ngày ông đánh tan khu quân_sự liên_hiệp Đà_Nẵng thần_tốc đưa binh từ Đà_Nẵng vào La_Ngà vừa đi vừa đánh mở_đường đưa một đạo quân hơn bốn vạn người hàng ngàn xe các loại vượt hơn nghìn km đánh tan ba_quân_khu địch tiến vào Dinh Độc_Lập bắt sống toàn_bộ quân Nguỵ trong vòng 18 ngày_đêm Nhưng để nói sâu_xa hơn về tầm_vóc cầm_quân chỉ_huy tác_chiến của ông thì phải nói đến trận Phản_Công Biên_Giới Tây_Nam lật_đổ chế_độ Polpot cứu dân_tộc Cam_Pu Chia khỏi hoạ diệt chủng Đây mới là trận đánh mang tầm_vóc xoay_chuyển càn khôn phô_diễn được tất_cả sự tinh_hoa của ông đưa tên_tuổi của ông vào ngôi đền của những vị tướng huyền_thoại Dưới sự chỉ_huy của ông quân_đội ta tiến vào Cao_Miên không đến ba ngày Các nước trong khu_vực chưa kịp phản_ứng gì thì không_lưu sân_bay Phnom Penh đã phát đi thông_báo giải_phóng bằng tiếng Việt khiến cho các nước trong khối Asean và thậm_chí cả Trung_Hoa đái ngập cả bỉm Bobby Cuối_cùng báo_chí có_thể quên ông nhưng chúng_tôi thì không Xin dâng nén tâm hương cùng lòng_thành_kính và biết_ơn vô_hạn đối_với cá_nhân ông trong các cuộc kháng_chiến vệ_quốc thống_nhất đất_nước",719,"1","2024-12-09T15:13:11.204299Z",717,3.438,"Neutral","2024-12-09T15:13:11.204299Z"
"không nhé f312 qđ 12 thinhphu5018",720,"1","2024-12-09T15:13:13.302602Z",718,1.697,"Neutral","2024-12-09T15:13:13.302602Z"
"Republic of South Vietnam ARVN tích_cực always remembered",721,"1","2024-12-09T15:13:15.152205Z",719,1.456,"Neutral","2024-12-09T15:13:15.152205Z"
"Trời Phật phù_hộ cho dân ta",722,"1","2024-12-09T15:13:18.702561Z",720,3.107,"Neutral","2024-12-09T15:13:18.702561Z"
"Cứ xem những thước phim lịch_sử Tôi lại khóc ông ngoại tội là thương_binh nặng Cứ mỗi lần trở_trời những vết_thương cũ lại hoành_hành ông Xem mà nước_mắt chạy Ông_cha ta đã hi_sinh để chúng_ta được tự_do như ngày hôm_nay",723,"1","2024-12-09T15:13:22.612386Z",721,3.487,"Thankful","2024-12-09T15:13:22.612386Z"
"Tối 29 4 quảng_trị đất mẹ ngọt_ngào",724,"1","2024-12-09T15:13:25.574307Z",722,2.558,"Neutral","2024-12-09T15:13:25.574307Z"
"letri3139 NGƯỜI YÊU NƯỚC CỘNG_SẢN VIỆTNAM PHẢI THÔNG_MINH LÊN PHẢI HIỀU ĂN CÂY NÀO THÌ RÀO CÂY ĐÓ MỚI CÓ TRÁI MÀ ĂN NGHĨA_LÀ LUÔN LUÔN TRUNG_THÀNH VỚI TỔ_QUỐC CỘNG_SẢN VIỆTNAM NƯỚC MỸ TỰ_DO DÂN_CHỦ NƯỚC MỸ SẼ KHÔNG NHẬN CHỨA_CHẤP CỘNG_SẢN VIỆTNAM CON_CHÁU CỦA CỘNG_SẢN VIỆTNAM",725,"1","2024-12-09T15:13:27.017973Z",723,1.016,"Neutral","2024-12-09T15:13:27.017973Z"
"Vô lạng sơn chết 1 3 đóng được mấy ngày thấy không ổn VN chưa đánh không_quân nữa mà chết cở đó rùi Quân_chính_quy VN chưa kéo về kịp về kịp chắc còn mạng mà rút quân tích_cực",726,"1","2024-12-09T15:13:38.214968Z",724,10.781,"Proud","2024-12-09T15:13:38.214968Z"
"Râ_t hay xu c ti ch sinh đô ng",727,"1","2024-12-09T15:13:40.459166Z",725,1.805,"Neutral","2024-12-09T15:13:40.459166Z"
"Ai_bảo trận này ta thua tích_cực",728,"1","2024-12-09T15:13:42.652653Z",726,1.774,"Neutral","2024-12-09T15:13:42.652653Z"
"phai noi la phi_thuong ngoai suc tuong tuong",729,"1","2024-12-09T15:13:45.041637Z",727,1.974,"Neutral","2024-12-09T15:13:45.041637Z"
"bố của bạn là 1 a hùng dân_tộc chúc gia_đình bạn sức_khỏe những gì bố bạn cốnv hiến cho dân_tộc luôn được khắc_ghi",730,"1","2024-12-09T15:13:47.702560Z",728,2.238,"Thankful","2024-12-09T15:13:47.702560Z"
"Hôm_qua 27 07 mình xem lịch_sử chiến_tranh Việt_Nam qua các thời_kì mà lòng nghẹn_ngào xúc_động Vô_cùng biết_ơn và tự_hào về đất_nước con_người các vị tướng qua từng thế_hệ Những đoạn phim như thế này cần được các thế_hệ xem và hiểu rõ để có được ngày hôm_nay cha_ông ta đã hy_sinh nhiều như thế_nào Thế_hệ chúng_ta cần xây_dựng đất_nước để đền_đáp công_lao này Biết_ơn vô_cùng Cảm_ơn người up những thước phim này Cảm_ơn những người góp_phần làm ra đoạn phim tuyệt_vời này",731,"1","2024-12-09T15:13:49.400926Z",729,1.284,"Neutral","2024-12-09T15:13:49.400926Z"
"Bạn không hiểu gì hết mục_đích của Đặng Tiểu_Bình là rất rõ_ràng muốn giúp_đỡ chế_độ Ponpot Campuchia đánh biên_giới VN mục_đích là để quân ta từ Campuchia rút về chi_viện từ đó Ponpot mới có cơ_hội lật_ngược tình_thế Nhưng điều này đã bị Tướng Võ_Nguyên Giáp thấu được nên Đặng Tiểu_Bình thấy kế_hoạch thất_bại mới kog đánh nữa từ đó mới có chuyện TQ rút quân",732,"1","2024-12-09T15:13:51.149573Z",730,1.325,"Neutral","2024-12-09T15:13:51.149573Z"
"Các nhà quay_phim cũng nguy_hiểm như các chiến_sĩ cầm súng chiến_đấu ngoài mặt_trận Có_thể hy_sinh bất_cứ lúc_nào khi quay_phim Cao lão ngũ",733,"1","2024-12-09T15:13:53.005249Z",731,1.441,"Neutral","2024-12-09T15:13:53.005249Z"
"Có một điều mình luôn thắc_mắc là Mỹ và VNCH luôn_luôn muốn QGP phải đánh quy_ước chứ không chơi du_kích nhưng khi được thỏa_nguyện đụng trận chính_quy quy_ước với QGP thì cả Mỹ và VNCH đều đánh_đấm như quần què vậy là sao các đồng_chí nhỉ face_with_hand_over_mouth face_with_hand_over_mouth face_with_hand_over_mouth",734,"1","2024-12-09T15:13:55.961276Z",732,2.523,"Neutral","2024-12-09T15:13:55.961276Z"
"Trung_Quốc dạy cho Việt_Nam bài_học cảnh_giác ông bạn phương bắc xấu_bụng",735,"1","2024-12-09T15:13:58.028863Z",733,1.681,"Neutral","2024-12-09T15:13:58.028863Z"
"Bạn có_thể đánh_bại được 1 đội quân nhưng không_thể_nào đánh_bại được cả 1 dân_tộc",736,"1","2024-12-09T15:14:00.897865Z",734,2.451,"Proud","2024-12-09T15:14:00.897865Z"
"toi nghiep cac ban kho da i nghe may thang o HaNoi ma bi sinh bac tu nam",737,"1","2024-12-09T15:14:03.088778Z",735,1.756,"Neutral","2024-12-09T15:14:03.088778Z"
"Từ hào quá việt nam ơi gđ tôi cũng có ông bác hy_sinh tại quảng_trị năm 1968 cũng là một sức Nho_nhỏ cho đất_nước Việt_nam",738,"1","2024-12-09T15:14:05.695643Z",736,2.197,"Proud","2024-12-09T15:14:05.695643Z"
"Chúc_Bà mạnh_khỏe để kể chuyện L s hào_hứng của Dân_tộc cho con_cháu nghe đặc_biệt là lúc bọn Ngụy_quyền Đu Càng trước ngày Thống_Nhất đất_nước",739,"1","2024-12-09T15:14:07.824654Z",737,1.687,"Thankful","2024-12-09T15:14:07.824654Z"
"kể_ra_quân Mỹ cũng không thua quân Nguyên Mông với vũ_khí và nhân_lực gần như vô_hạn",740,"1","2024-12-09T15:14:09.868145Z",738,1.641,"Neutral","2024-12-09T15:14:09.868145Z"
"Cám_ơn các a đã dũng_cảm chiến_đấu vì hòa bình ngày_nay",741,"1","2024-12-09T15:14:12.447099Z",739,2.148,"Thankful","2024-12-09T15:14:12.447099Z"
"250k dân_công là tôn_vinh cái tinh_thần dân_tộc chứ thực_tế_cụ tư lênh nói vận_chuyển là nhờ 200 xe oto cơ_giới Chiếm 80 năng_lực vận_chuyển trong toàn chiến_dịch",742,"1","2024-12-09T15:14:14.581836Z",740,1.712,"Neutral","2024-12-09T15:14:14.581836Z"
"Chiến_dịch khe sanh cả ta và địch thương_vong quá nhiều",743,"1","2024-12-09T15:14:17.773386Z",741,2.752,"Sad","2024-12-09T15:14:17.773386Z"
"tôi sẽ giữ được xuân lộc tôi chắc_chắn và cuối_cùng bị bắt sống",744,"1","2024-12-09T15:14:22.225958Z",742,4.024,"Sad","2024-12-09T15:14:22.225958Z"
"Làm gì có đại_học nói cho vui_miệng à",745,"1","2024-12-09T15:14:26.569695Z",743,3.9,"Neutral","2024-12-09T15:14:26.569695Z"
"không_quân và hải_quân khá mạnh ở tây nguyên có gì đó sai sai",746,"1","2024-12-09T15:14:29.273017Z",744,2.109,"Neutral","2024-12-09T15:14:29.273017Z"
"huahuachi9421 Nhật và Pháp thay nhau đô_hộ VN 100 năm Bác Hồ đứng lên khởi_nghĩa 1943 và giành lấy độc_lập 1945 trong thời_gian chiến_đấu đẩy_lùi ách cai_trị của Pháp Mỹ đã viện_trợ cho Pháp từ năm 1948 1952 nên sau_này Pháp rút Mỹ nhảy vào lập nên chê độ bù_nhìn VNCH trong miền nam Mày phải nên hiểu ngay từ đầu đâu là những kẻ xâm_lược Chính cuộc kháng_chiến chống thực_dân của Pháp của Bác là động_lực của các cuộc nổi_dậy giành lấy độc_lập của 51 quốc_gia khác từ các lục_địa châu phi và nam mỹ trung mỹ",747,"1","2024-12-09T15:14:30.750997Z",745,1.073,"Neutral","2024-12-09T15:14:30.750997Z"
"21 50 Có_vẻ như lúc đó người Pháp đã quên bài_học phòng_tuyến Maginot thời Thế_chiến 2",748,"1","2024-12-09T15:14:32.885820Z",746,1.706,"Neutral","2024-12-09T15:14:32.885820Z"
"Việt_Nam bị hủy_diệt lao_động trí_thức từ trước năm 1945 rồi TỘI_ÁC CỦA MỸ NGỤY VNCH 3 stadium pile_of_poo Đế_quốc Pháp Nhật_Mỹ xâm_lược Việt_Nam đã dùng người Việt_trị người Việt nên dựng lên chính_quyền tay_sai VNCH volcano VNCH 3 là tay_sai do Pháp Nhật_Mỹ dựng lên collision Thời_kỳ Pháp thuộc_địa chủ cường hào bóc_lột dân cống_nạp cho Pháp năm 1867 1945 gđ vào VN trước backhand_index_pointing_right giai_đoạn này VN mất chủ_quyền Pháp dựng chính_quyền bù_nhìn cờ vàng 3 xanh quốc_ca Chinh phụ ngâm collision 1945 Nhật nhảy vào buộc Pháp phải hàng Thời này Địa_chủ cường hào làm tay_sai trước làm cho Pháp cho Nhật rồi Pháp quay trở_lại lần 2 Nhật địa chủ ép dân nhổ lúa trồng đay để làm thuốc_súng dùng tô cao thuế_nặng để thâu_tóm 70 90 ruộng_đất_đai của_cải về tay địa chủ cường hào Vatican backhand_index_pointing_right Gây nạn chết đói hơn 2 triệu dân VN chết Thời đó VN phải nộp cho Nhật 1 tỷ 446 triệu Prastre 14 tỷ 460 triệu Frane backhand_index_pointing_right Cờ vàng 3 đỏ có từ 09 03 1945 với các tên dog Đế_Quốc VN 1945 Chính_phủ bù_nhìn do Trần_Trọng_Kim làm TT gây nạn chết đói năm 1945 Nhật dog Quốc_gia VN 1949 Pháp cờ vàng 3 xanh sửa thành cờ vàng 3 đỏ Bài chào cờ Công_dân ơi cửa ĐVCs Lưu Hữu_phước làm quốc_ca không có ngày quốc_khánh dog Đệ nhất Cộng_Hòa 1955 1963 Mỹ Lê máy_chém đi chặt đầu người xỏ thép gai ở chân tay đẩy xuống sông bắt_bớ tra_tấn cực_hình backhand_index_pointing_right với khẩu_hiệu Giết lầm hơn bỏ sót của luật 10 59 1955 truất phế vua Bảo Đại 1963 anh_em họ Ngô_Đình diệm bị VNCH đảo_chính sát_hại theo lệnh của Mỹ dog Đệ Nhị_Cộng_Hòa QLVN Cộng_Hòa TT Nguyễn Văn_Thiệu 1967 1975 Mỹ_Tàn_sát dân bắt_bớ cướp hiếp dân bừa_bãi Dội 15 triệu tấn bom_đạn gần 80 triệu lít Dioxin chất_độc màu_da_cam gây ung_thư quái_thai 1961 1971 xuống Việt_nam Gây nhiều cuộc thảm_sát đẫm máu Huế Mỹ_lai Lập nhiều nhà_tù tra_tấn cực_hình và giết_hại người VN vì hòa_bình trong đó tàn_ác nhất là Nhà_tù Côn_Đảo Trong hơn 100 năm khoảng 20 000 người VN bị giam_cầm hy_sinh tại đây backhand_index_pointing_right Địa_ngục trần_gian Vậy_mà Mỹ VNCH tay_sai luôn tuyên_truyền cho cuộc chiến_tranh ở Việt_Nam rằng cộng_sản là ác cộng_sản là xấu_xa cs gây ra chiến_tranh mà Mỹ phải ngăn_chặn cs là phi_lý Tội_ác Mỹ ngụy_còn in trong tâm_khảm người Việt_Nam Cộng_sản là người dân không chịu nổi sự áp_bức bóc_lột tàn_sát của kẻ xâm_lược mà vùng lên đánh_đuổi chứ không phải họ là tác_nhân gây ra chiến_tranh như Mỹ VNCH tay_sai tuyên_truyền Chính Việt_nam Cộng_hòa 3 làm mất gần 70 đảo lớn nhỏ của Việt_Nam Nhưng chúng vẫn chối tội đổ_thừa cho đối_phương Bằng_chứng tội_ác của chúng là đã bị nhân_dân Việt_nam đánh_đuổi từ 30 04 1975 Phim Mỹ nói về nhân_quyền thời VNCH làm tay_sai nè backhand_index_pointing_right https youtu be QXq_Ftnm2Sw",749,"1","2024-12-09T15:14:34.265812Z",747,0.952,"Neutral","2024-12-09T15:14:34.265812Z"
"Thì nó đánh theo kiểu do Mỹ nó đề ra có bài_bản gì về chiến_thuật đâu để nó đi chiến rừng_núi khác gì địa_ngục đối_với nó khi nó chưa đánh rừng_núi bao_giờ đánh ở đồng_bằng chưa ăn ai đòi chơi rừng_núi đúng sở_trường của VN mình",750,"1","2024-12-09T15:14:45.186396Z",748,3.161,"Neutral","2024-12-09T15:14:45.186396Z"
"Đơn_giản là éo có cửa",751,"1","2024-12-09T15:14:46.768094Z",749,1.125,"Neutral","2024-12-09T15:14:46.768094Z"
"anhtuannguyen2118 anh nó là lính VNCH đấy không phải bộ_đội mình đâu mà chia buồn",752,"1","2024-12-09T15:14:49.574459Z",750,2.39,"Neutral","2024-12-09T15:14:49.574459Z"
"Việt_Nam mình có câu chó cùng đạp bờ dậu Phải_chăng Pháp Mỹ đã cùng_quẫn bế_tắc ở cái nước thuộc_địa nghèo xơ_xác này",753,"1","2024-12-09T15:15:12.112013Z",751,22.128,"Neutral","2024-12-09T15:15:12.112013Z"
"Lính úc nữa ông ạ",754,"1","2024-12-09T15:15:15.393983Z",752,2.827,"Neutral","2024-12-09T15:15:15.393983Z"
"Cam on chắc_chắn bạn rất giỏi về môn lịch_sử của dân_tộc rồi một môn_học mà trước đây khi còn ngồi trên ghế nhà_trường cứ ngồi vào học là mình bị ngủ_gật luôn vậy_mà bây_giờ mình xem những bài lịch_sử này thật hay như xem phim_vậy đúng là Thời theo thế thể thời phải thế_là như thế này sao rất tuyệt_vời cảm_ơn chương_trình tích_cực",755,"1","2024-12-09T15:15:18.668445Z",753,2.847,"Neutral","2024-12-09T15:15:18.668445Z"
"mình để_ý lâu lắm rồi mà chưa tìm_hiểu ra lý_do chính_thức việc có mũi_tên mầu trắng trên vành mũ bộ_đội mình Có_lẽ là hướng chỉ hướng tới miền nam hay không nhỉ Bạn nào có thông_tin chia_sẻ giúp mình Trân_trọng cảm_ơn",756,"1","2024-12-09T15:15:21.059994Z",754,1.959,"Neutral","2024-12-09T15:15:21.059994Z"
"face_with_open_mouth hainam7253 crying_face tướng nào mang tầm ảnh hướng quốc_tế thì cao hơn",757,"1","2024-12-09T15:15:24.684980Z",755,3.179,"Neutral","2024-12-09T15:15:24.684980Z"
