"Fixed_Comment","annotation_id","annotator","created_at","id","lead_time","sentiment","updated_at""Họ giàu vì họ không bị chiến_tranh thêm 1 chút_xíu nữa là 1 bộ_phận người Việt xính hàng Thái hàng Thái tràn sang ta hơi nhiều bóp_chết hàng Việt_vd quần_áo_nước giặt nước_giải_khát bò húc carabao đó và phần_nào đó ta chưa có kinh_nghiệm Bây_giờ ta có nhiều mặt_hàng hơn họ gạo ST chẳng_hạn mong người Việt ủng_hộ hàng Việt_Nam nói_chung để sản_xuất_phát_triển thì sẽ giàu_có thôi",1350,"1","2024-12-10T13:27:11.997014Z",1348,2.697,"Neutral","2024-12-10T13:27:11.997014Z"
"Khá nhiều người xem xong bị tẩy_não",1351,"1","2024-12-10T13:27:13.327546Z",1349,1.04,"Neutral","2024-12-10T13:27:13.327546Z"
"Đúng Họ đã hủy_diệt quê_hương đất_nước mình Nguyễn Văn_Thiệu những kẻ ở đây đi lính VNCH và Hoa_Kỳ đã cấu_kết với nhau Tất_cả họ đều có tội_ác như nhau",1352,"1","2024-12-10T13:27:15.689251Z",1350,2.055,"Neutral","2024-12-10T13:27:15.689251Z"
"Thà c h ế t không khai Không Phải Em Nào đâu phải em Thằng bán kem nó chạy mất rồi Thực_tế bố của bạn biết gì đâu mà khai mới thác Đi bộ_đội thời_bình sĩ_quan cũng chỉ việc ai người ấy làm Những việc khác đều là bí_mật quân_sự Chưa nói đến những kế_hoạch Tuyệt_Mật_Bố của b chắc là binh_nhì Hoặc cứ cho là chuẩn_uý face_with_tears_of_joy Thì đối_với phe kia bố của bạn chẳng có tí giá_trị gì Nói_thẳng nhé theo cách hành_văn bl cha nào con nấy rất kiên_cường quyết_đoán Không bao_giờ bán_đứng bán rẻ anh_em Khi chưa được giá face_with_tears_of_joy face_with_tears_of_joy face_with_tears_of_joy",1353,"1","2024-12-10T13:27:16.696657Z",1351,0.713,"Neutral","2024-12-10T13:27:16.696657Z"
"Rồi cuoi cung ai thắng thuong vong moi bên bao_nhiêu",1354,"1","2024-12-10T13:27:19.502264Z",1352,2.502,"Neutral","2024-12-10T13:27:19.502264Z"
"Giá trả là rất lớn",1355,"1","2024-12-10T13:27:21.979277Z",1353,2.191,"Sad","2024-12-10T13:27:21.979277Z"
"cho mình hỏi nếu đoàn 232 là Binh_Đoàn Cửu_Long quân_đoàn IV vậy thì quân_đoàn IV ở hướng Đông_Bắc là lực_lượng gì vậy",1356,"1","2024-12-10T13:27:33.697520Z",1354,11.41,"Neutral","2024-12-10T13:27:33.697520Z"
"Có ae nào biết 4 người ngồi bàn chiến_thuật trong đó có Bác Hồ_Bác Giáp với 2 người nữa ai biết 2 ng đó tên gì không vậy lúc 17 12",1357,"1","2024-12-10T13:27:36.192442Z",1355,2.182,"Neutral","2024-12-10T13:27:36.192442Z"
"Giành độc_lập tư do bằng xương_máu hàng triệu người Thế_mà nay họ để cho bọn lật sử phá_hoại tan_nát sử Việt",1358,"1","2024-12-10T13:27:38.159807Z",1356,1.679,"Neutral","2024-12-10T13:27:38.159807Z"
"21 01 có một ông nhìn giống Hít Le_thế nhỉ",1359,"1","2024-12-10T13:27:40.117626Z",1357,1.649,"Neutral","2024-12-10T13:27:40.117626Z"
"vanhoainam5925 Ban noi dung qua thumbs_up thumbs_up thumbs_up thumbs_up thumbs_up thumbs_up thumbs_up thumbs_up thumbs_up thumbs_up thumbs_up thumbs_up thumbs_up",1360,"1","2024-12-10T13:27:42.175113Z",1358,1.777,"Neutral","2024-12-10T13:27:42.175113Z"
"Bố mình bảo trong cuộc_đời_binh nghiệp chỉ kính_trọng 2 vị đại_tướng Võ_Nguyên_Giáp và Lê Trọng Tấn Nếu tướng LTT chiếm luôn Thailand làm chư_hầu thì VN bây_giờ đã có GDP đầu người tầm_tầm 20k face_with_tears_of_joy smiling_face_with_smiling_eyes",1361,"1","2024-12-10T13:27:50.744960Z",1359,8.278,"Proud","2024-12-10T13:27:50.744960Z"
"Năm này tính giải_phóng luôn mà không được nên thiệt_hại hy_sinh quá nhìu xong năm 68 phải giải_thể 1 số sư_đoàn",1362,"1","2024-12-10T13:27:52.631022Z",1360,1.577,"Neutral","2024-12-10T13:27:52.631022Z"
"Razuma cả chỗ lính từ cam không về là sai nữa Sau khi đánh nhau tầm 1 tuần là c130 bốc quân từ cam về đánh cx nhiều không thì không đỡ nổi",1363,"1","2024-12-10T13:27:55.252448Z",1361,2.308,"Neutral","2024-12-10T13:27:55.252448Z"
"Và từ đó quân nực VN cộng hành thành_lập ra binh_đoàn đu càng mạnh nhất thế_giới thật là vãi chưởng các bạn ạ winking_face_with_tongue",1364,"1","2024-12-10T13:27:56.989728Z",1362,1.459,"Neutral","2024-12-10T13:27:56.989728Z"
"Thằng ngồi nhà trắng thì báo_cáo chiến_thắng thằng sung trận thì chết như rạ",1365,"1","2024-12-10T13:27:58.690321Z",1363,1.406,"Neutral","2024-12-10T13:27:58.690321Z"
"Mỗi lần tôi xem những video như thế này trong tôi lại trào_dâng lòng tự_hào dân_tộc Xin ngàn lần cảm_ơn ông_cha ta đã anh_dũng hy_sinh để bảo_vệ tổ_quốc",1366,"1","2024-12-10T13:28:01.286169Z",1364,2.307,"Thankful","2024-12-10T13:28:01.287169Z"
"thần_kinh à mĩ cả cuộc chiên việt nam chỉ có 55k người mất_tích đào đâu ra riêng khe sanh đến 125k người việt_nam nào 10 người hi_sinh",1367,"1","2024-12-10T13:28:07.626699Z",1365,6.036,"Angry","2024-12-10T13:28:07.627697Z"
"Vì họ cấm súng là vì tiền một trận chiến phi_nghĩa không được ủng_hộ còn quân giải_phóng là cuộc_chiến bảo_vệ tổ_quốc một cuộc_chiến được nhân_dân ủng_hộ",1368,"1","2024-12-10T13:28:10.826035Z",1366,2.911,"Thankful","2024-12-10T13:28:10.826035Z"
"Kẹt Công_Hàm_gởi cho Tr Quôc Đảng_Ta nào dám HÓ_HÉ gì đâu Chả nhẻ cứ đẩy THU HẮNG ra lập đi lập lại mãi câu QUAN_NGẠI SÂU_SẮC nghe đi nghe lại hoài CHÁN NGẤY nay chỉ còn biết XÚI các nước quanh LƯỞI BÒ như Phillipin Brunei Mả_Lai_Indonésia QUẬY dùm theo kiểu XÚI GÀ ĂN KÍT nhắm được thì Đảng_Ta ĐẬP ĐUÔI ĂN_THEO",1369,"1","2024-12-10T13:28:12.329880Z",1367,1.213,"Neutral","2024-12-10T13:28:12.329880Z"
"Luôn ủng_hộ kênh tích_cực Các sản_phẩm đều có sự đầu_tư nghiêm_túc Dữ_kiện và hình_ảnh minh_hoạ biên_tập rất hay tích_cực",1370,"1","2024-12-10T13:28:13.698453Z",1368,1.083,"Neutral","2024-12-10T13:28:13.698453Z"
"xuasaigon4665 nhưng mà ít_nhất bác Hồ đi để trở về còn hơn là đi để khát nước vào ngày 30 4 hằng năm",1371,"1","2024-12-10T13:28:16.852283Z",1369,2.841,"Neutral","2024-12-10T13:28:16.852283Z"
"Xdx⁴ smiling_face_with_smiling_eyes red_heart red_heart red_heart face_with_tears_of_joy ôơ ơ crying_face face_with_open_mouth grinning_face_with_sweat smiling_face_with_smiling_eyes smiling_face_with_smiling_eyes smiling_face_with_smiling_eyes smiling_face_with_smiling_eyes red_heart",1372,"1","2024-12-10T13:28:18.470514Z",1370,1.325,"Neutral","2024-12-10T13:28:18.470514Z"
"Đế_quốc Mỹ mạnh nhất thế_giới về kt quân_sự vũ_khí hiện_đại vậy_mà thua một nước nhỏ_bé nghèo_nàn lạc_hậu_quân Mỹ quá nhục_nhã và chứng_tỏ cacTưowngsvà lính của bộ_đội ta quá giỏi Voocungf tự_hào và biết_ơn quân_dân VN",1373,"1","2024-12-10T13:28:20.797684Z",1371,2.024,"Neutral","2024-12-10T13:28:20.797684Z"
"TẠI_SAO QUÂN TRUNG QUỐC KHÔNG TIẾN XUỐNG HÀ NỘI TRONG CHIẾN_TRANH BIÊN_GIỚI VIỆT TRUNG 1979 Sợ không đường về thôi",1374,"1","2024-12-10T13:28:22.651219Z",1372,1.552,"Neutral","2024-12-10T13:28:22.651219Z"
"Hay về ông_cha đánh giac Còn thằng dẩn truong trình nói đi nói lại cả tiếng đồng_hồ chỉ có một câu_chuyện lập đi lập lại Nói nhiều mà chuyen tả chả bao_nhiêu",1375,"1","2024-12-10T13:28:24.765425Z",1373,1.806,"Neutral","2024-12-10T13:28:24.765425Z"
"Chỉ cần nghe ba chữ đánh Trung_Quốc là toàn dân Việt_Nam sẵn_sàng xăm hai chữ Sát Thát lao ra chiến_trường để quyết_tử cho Tổ_Quốc quyết_sinh liền",1376,"1","2024-12-10T13:28:28.494830Z",1374,3.423,"Proud","2024-12-10T13:28:28.494830Z"
"Đời_đời nhớ ơn các liệt_sĩ anh_hùng",1377,"1","2024-12-10T13:28:30.512900Z",1375,1.74,"Thankful","2024-12-10T13:28:30.512900Z"
"Đời_đời ghi_nhớ công_ơn của ông_cha ta",1378,"1","2024-12-10T13:28:31.877093Z",1376,1.07,"Thankful","2024-12-10T13:28:31.877093Z"
"Chúng cháu cảm_ơn bác Chúc bác thật nhiều niềm vui và sức_khoẻ",1379,"1","2024-12-10T13:28:33.186898Z",1377,1.018,"Thankful","2024-12-10T13:28:33.186898Z"
"Không học vẫn đánh mười tướng",1380,"1","2024-12-10T13:28:36.223510Z",1378,2.749,"Proud","2024-12-10T13:28:36.223510Z"
"Thời đó khai tên tuổi giả nhiều lắm bạn",1381,"1","2024-12-10T13:28:38.843942Z",1379,2.319,"Neutral","2024-12-10T13:28:38.843942Z"
"Ông cụ tui là dân_công hoả_tuyến của trận ĐBP này",1382,"1","2024-12-10T13:28:44.993290Z",1380,5.853,"Proud","2024-12-10T13:28:44.993290Z"
"Tướng ngô quang trưởng chỉ_huy tái_chiếm quảng_trị do binh_chủng thủy_quân lục chiến và nhảy_dù trận chiến kéo_dài 81 ngày_đêm quân giãi phóng tiêu_hao và thiệt_hại rất nhiều cho chiến_trường mùa hè đỏ_lửa 1972 này ông bạn nhé Biết thì nói không biết thì thôi nhưng dù_sao cũng xót_thương cho đồng_bào miền bắc đã có những con e xung_phong đi vào vùng lửa_đạn nầy để rồi ra đi mãi",1383,"1","2024-12-10T13:28:49.035067Z",1381,3.736,"Neutral","2024-12-10T13:28:49.035067Z"
"Vũ_khí của Việt_Cộng không so được với Mỹ Ngụy Nhưng Việt_Cộng lại có tình_báo cài trong lòng địch",1384,"1","2024-12-10T13:28:53.089513Z",1382,3.759,"Proud","2024-12-10T13:28:53.089513Z"
"Làm_gì co quân giãi phomg miền nam chi tuyển truyen thôi",1385,"1","2024-12-10T13:28:55.504324Z",1383,2.113,"Neutral","2024-12-10T13:28:55.504324Z"
"Người Mỹ thật ngây_thơ họ nghĩ người cs cũng ngây_thơ như họ",1386,"1","2024-12-10T13:28:57.345444Z",1384,1.533,"Neutral","2024-12-10T13:28:57.345444Z"
"Sao aap không làm về QGP toàn đưa những tin đâu_đâu thế",1387,"1","2024-12-10T13:28:59.035748Z",1385,1.399,"Neutral","2024-12-10T13:28:59.035748Z"
"Chiến_tranh thật khốc_liệt Hoà_bình phải đánh_đổ nhiều xương_máu quá Cảm_ơn các anh đã ngã xuống cho độc_lập ngày_nay hand_with_index_finger_and_thumb_crossed red_heart red_heart red_heart hand_with_index_finger_and_thumb_crossed",1388,"1","2024-12-10T13:29:01.482781Z",1386,2.146,"Sad","2024-12-10T13:29:01.482781Z"
"Đây là loạt bài nhằm cổ suý các thế_hệ trẻ nên lập lại chiến_tích thần_kỳ như đã gom biết_bao của_cải đã cướp được của miền Nam VN từ năm 1975 và của Khơ_Me vào 1977 1978 Miền Bắc của chúng_ta lúc ấy còn nghèo mạt chưa bao_giờ thấy và biết được thế_nào là đời_sống văn_minh Nhờ các cuộc_chiến này con_cháu Đảng mới có được như ngày_nay",1389,"1","2024-12-10T13:29:03.354629Z",1387,1.539,"Neutral","2024-12-10T13:29:03.354629Z"
"đoi đoi con chau nho on mau xuong cua cha ong đa chay xuong đe_con chau co được nen đoc lap tu do k co lich su đau tranh nao bang tinh than không co gi quy hon đoc lap tu do",1390,"1","2024-12-10T13:29:05.609033Z",1388,1.963,"Neutral","2024-12-10T13:29:05.609033Z"
"Coi lại mà thấy mắc_cỡ cho quân_lực vnch vậy_mà mấy cha già toàn nổ nghe không biết thẹn lòng tui nghe cha tui nói khi ông tù cs về ông nói vnch là 1 đội quân đánh thuê và càn quyét rất mất_dạy Vô làng là vơ_vét Càn_quấy vô kỷ_luật cộng_sản nó Mới là kẻ có lý_tưởng và là kẻ chính_nghĩa nha Là chủ quốc_gia Từ OkaLahomacitys",1391,"1","2024-12-10T13:29:07.105221Z",1389,1.177,"Neutral","2024-12-10T13:29:07.105221Z"
"Xin cúi mình với mỗi người Chiến_Sĩ Điện_Biên phủ năm xưa Muốn chiến_thắng ngoài tướng giỏi phải có quân tốt và dũng_cảm",1392,"1","2024-12-10T13:29:08.783245Z",1390,1.385,"Thankful","2024-12-10T13:29:08.783245Z"
"Cơn ác_mộng của cả vn và mỹ Vn thắng nên giờ ng ta nói đó là ác_mộng của mỹ thắc_mắc nữa k",1393,"1","2024-12-10T13:29:12.570033Z",1391,3.483,"Proud","2024-12-10T13:29:12.570033Z"
"Chúng cháu cảm_ơn ô Ô_nội cháu cũng hi_sinh tại chiến_trường Trị_Thiên khi đi thực_hiện trinh_sát chiến_trường cho các chiến_dịch chuẩn_bị trận khe sanh Cảm_ơn ô",1394,"1","2024-12-10T13:29:14.223869Z",1392,1.362,"Thankful","2024-12-10T13:29:14.223869Z"
"Đây là loạt bài nhằm cổ suý các thế_hệ trẻ nên lập lại chiến_tích thần_kỳ như đã gom biết_bao của_cải đã cướp được của miền Nam VN từ năm 1975 và của Khơ_Me vào 1977 1978 Miền Bắc của chúng_ta lúc ấy còn nghèo mạt chưa bao_giờ thấy và biết được thế_nào là đời_sống văn_minh Nhờ các cuộc_chiến này con_cháu Đảng mới có được như ngày_nay",1395,"1","2024-12-10T13:29:15.652195Z",1393,1.147,"Neutral","2024-12-10T13:29:15.652195Z"
"thì Liên_Xô cũng có tỉnh Trung_Quốc",1396,"1","2024-12-10T13:29:17.263795Z",1394,1.313,"Neutral","2024-12-10T13:29:17.263795Z"
"Lời_nói không bằng trời nói face_with_tears_of_joy face_with_tears_of_joy",1397,"1","2024-12-10T13:29:19.980260Z",1395,2.415,"Neutral","2024-12-10T13:29:19.980260Z"
"Người Việt_Nam rất quân_tử Không thấp như người Mỹ Việt_Nam mãi_mãi trường_tồn phồn_thịnh Vietnam Vietnam Vietnam Vietnam Vietnam_fire",1398,"1","2024-12-10T13:29:21.591582Z",1396,1.293,"Neutral","2024-12-10T13:29:21.591582Z"
"Con cám_ơn công_lao to_lớn của bác và đồng_đội đã cho chúng con có được nền hoà_bình ngày hôm_nay Con chúc bác thật nhiều sức_khoẻ ạ",1399,"1","2024-12-10T13:29:23.177818Z",1397,1.299,"Thankful","2024-12-10T13:29:23.177818Z"
"Thế_mà tôi không biết bác tôi đã từng chiến_đấu tại chiến_trường ác_liệt này",1400,"1","2024-12-10T13:29:24.762764Z",1398,1.289,"Neutral","2024-12-10T13:29:24.762764Z"
"Đúng rồi giống như trái bom CBU Long Khánh_thôi",1401,"1","2024-12-10T13:29:26.438982Z",1399,1.36,"Neutral","2024-12-10T13:29:26.438982Z"
"Muốn nge mãi veydien bnel",1402,"1","2024-12-10T13:29:27.663550Z",1400,0.927,"Neutral","2024-12-10T13:29:27.663550Z"
"Không còn từ_ngữ nào để nói về những chiến_công của ông_cha ta chỉ còn biết kính_cẩn nghiêng_mình",1403,"1","2024-12-10T13:29:30.026918Z",1401,2.064,"Thankful","2024-12-10T13:29:30.026918Z"
"Không xem thì thôi ai mướn Ở VN làm gì cho chật đất",1404,"1","2024-12-10T13:29:32.755059Z",1402,2.426,"Neutral","2024-12-10T13:29:32.755059Z"
"Trong Chiến_Dịch này Đảng_Ta đã phải hy_sinh ít_nhất 50 ngàn bộ_đội VỊ THÀNH_NIÊN Tất_cả các binh_trạm bệnh_xá dã_chiến kho đạn kho lương_thực của ta đều bị thiêu_huỷ Ngoài_ra còn có một_số Đồng_Chí cấp Tướng của bậc thầy Tr_Quốc cũng mất xác về tay Nguỵ Đó là một mất_mát lớn_lao cho Đảng_Ta và Đồng_Chí TQ",1405,"1","2024-12-10T13:29:33.999465Z",1403,0.949,"Neutral","2024-12-10T13:29:33.999465Z"
"Tại vì đặng tiểu Bình chỉ muốn dạy cho VN một bài_học hay",1406,"1","2024-12-10T13:29:35.174474Z",1404,0.877,"Neutral","2024-12-10T13:29:35.174474Z"
"Dân_công cũng góp Công_sức để chiến_thắng Vậy_mà bây_giờ hòa bình rồi thì có mấy người được hưởng chế_độ đời dân_công đâu",1407,"1","2024-12-10T13:29:47.017310Z",1405,11.543,"Angry","2024-12-10T13:29:47.017310Z"
"red_heart red_heart red_heart red_heart red_heart red_heart red_heart red_heart red_heart VN vv party_popper party_popper party_popper party_popper party_popper party_popper party_popper party_popper party_popper",1408,"1","2024-12-10T13:29:49.437267Z",1406,2.103,"Neutral","2024-12-10T13:29:49.437267Z"
"Rất biết_ơn và ngưỡng_mộ gia_đình red_heart red_heart red_heart",1409,"1","2024-12-10T13:29:51.137659Z",1407,1.378,"Thankful","2024-12-10T13:29:51.137659Z"
"Quá hay hãy nhìn về quá_khứ để hướng tới tương_lai",1410,"1","2024-12-10T13:29:55.966972Z",1408,4.529,"Thankful","2024-12-10T13:29:55.966972Z"
"Bác Hồ và Bác Giáp là hai vì Tinh_Tú trên bầu_trời Hai vì Tinh_Tú đó xuất_hiện để đem lại độc_lập tự_do cho dân_tộc Việt_Nam Dân_tộc Việt_Nam đời_đời biết_ơn 2 vì Tinh_Tú ấy",1411,"1","2024-12-10T13:29:57.288893Z",1409,1.012,"Neutral","2024-12-10T13:29:57.288893Z"
"Ô thằng tây này khôn đấy biết học tiếng Việt_này",1412,"1","2024-12-10T13:30:00.522691Z",1410,2.934,"Angry","2024-12-10T13:30:00.522691Z"
"Bố tôi là lính đặc_công cũng tham_gia đánh Mỹ ngụy từ năm 1960 đến năm 1974 ông bị_thương năm lần mới nghỉ nghe lại những trang Lịch_sử này cảm_động thật giờ mình đã nghỉ hưu rồi bố Minh vẫn khỏe red_heart cảm_ơn kênh",1413,"1","2024-12-10T13:30:04.803465Z",1411,3.968,"Thankful","2024-12-10T13:30:04.803465Z"
"migoi7028 bạn nói hay lắm những người luôn chỉ muốn sống dựa vào bọn cướp nước nge theo đe_quốc mà chia_rẽ đồng_bào tốt nhất cút khỏi đất_nước Việt_Nam này chứ sống mà không biết nhìn vào thực_tế xem_lại lịch_sử thì sang Mỹ mà làm chó_săn hay kẻ ăn_mày đường_phố chợ nó đã với cái giấc mơ tự_do",1414,"1","2024-12-10T13:30:08.065839Z",1412,2.971,"Neutral","2024-12-10T13:30:08.065839Z"
"láo với bác Giáp tao hả bác Giáp_tao mới vả vỡ mồm gần 20 tướng thôi bác Giáp_tao chỉ là thầy_giáo lịch_sử thôi",1415,"1","2024-12-10T13:30:11.819082Z",1413,3.457,"Proud","2024-12-10T13:30:11.819082Z"
"Đánh xài gòn bằng mắt à mà kêu đánh xài_gòn",1416,"1","2024-12-10T13:30:13.330376Z",1414,1.196,"Neutral","2024-12-10T13:30:13.330376Z"
"lephiai1610 cám_ơn cháu thanh_niên lúc đó ai cũng vậy ra đi cầm súng nhẹ như lông_hồng những nghười tham_gia chiến_dịch giờ còn sống ít lắm cơ hôi giao_lưu_không còn từ khi hội chiến_sĩ bảo_vệ thành cổ bị giải_tán gio có quá nhiều vi_phạm",1417,"1","2024-12-10T13:30:14.483340Z",1415,0.861,"Neutral","2024-12-10T13:30:14.483340Z"
"TQ không tiến xuống HN là do thương dân VN giống như Pháp Nhật_Mỹ ấy face_with_tears_of_joy face_with_tears_of_joy face_with_tears_of_joy face_with_tears_of_joy nói_chung mấy nước_lớn ngta thương dân lắm face_with_tears_of_joy",1418,"1","2024-12-10T13:30:29.398708Z",1416,14.621,"Neutral","2024-12-10T13:30:29.398708Z"
"không phải tướng Văn_Tiến_Dũng là tư_lệnh chiến_dịch hồ chí minh còn lê trọng tấn là phó tư_lệnh à",1419,"1","2024-12-10T13:30:30.690436Z",1417,0.986,"Neutral","2024-12-10T13:30:30.690436Z"
"Nếu không có việtnam cộng hòa thì mỹ đã không giết được nhiều lính viẹt nam",1420,"1","2024-12-10T13:30:32.030692Z",1418,1.03,"Neutral","2024-12-10T13:30:32.030692Z"
"グエントゥアン ông người nước nào mà cũng biết tiếng Việt_vậy người tàu à ông có biết người vn không muốn làm nô nê cho Mỹ không người miền đứng nên đó ông còn những người mà ông bảo chỉ có bọn muốn làm nô nê cho Mỹ và một_số cơ_hội thôi",1421,"1","2024-12-10T13:30:35.376016Z",1419,2.036,"Neutral","2024-12-10T13:30:35.376016Z"
"Biết vườn không nhà trống_không bộ_não qg sẽ chuyển đi nơi khác Khựa không bh lm đcvc gì",1422,"1","2024-12-10T13:30:58.985376Z",1420,18.634,"Neutral","2024-12-10T13:30:58.985376Z"
"Mình chia_xẻ quảng_cáo với Bạn chớ không cần tiền 200k đâu nhé",1423,"1","2024-12-10T13:31:55.655155Z",1421,56.288,"Neutral","2024-12-10T13:31:55.655155Z"
"Trung_quốc chỉ nói mơ cả ngàn đời chúng có bao_giờ đến được Hà_Nội toàn nói_phét phải nói bọn trung quốc thông_minh hết phàn bò",1424,"1","2024-12-10T13:31:59.298213Z",1422,3.323,"Neutral","2024-12-10T13:31:59.298213Z"
"Nó đánh dặn mặt vì 1 lũ thất_hứa vụ chia_sớt 1 số đảo cho nó do lúc đó đã hứa giúp hỗ_trợ đánh chiếm MNVN lúc bbaays giờ khi xong việc rồi tính bỏ_qua từ đó nó đánh cho 1 trận chi bỏ cái tội ngu xong qua năm 85 nó hốt luôn cái đảo dám ra đó đòi rolling_on_the_floor_laughing rolling_on_the_floor_laughing rolling_on_the_floor_laughing",1425,"1","2024-12-10T13:32:00.487780Z",1423,0.895,"Neutral","2024-12-10T13:32:00.487780Z"
"Thơ i na o cu ng vâ y tướng giỏi thi li nh kho e Không bi chê t quan Đa nh trâ n ma gă p ngươ i như thơ i tam quô c ca i thă ng Â u Thươ ng chi biê t_binh pha p ly thiê t chư không biê t_dụng_binh pha p go i la thực ha nh nên Khô ng Minh_Gia_Ca t Lươ ng thất_thu Gia Đi nh nên mơ i bại la vâ y đo Thơ i nay cu ng vâ y nhiê u ngươ i no i thao_thao bâ t tuyê t bâ t_cư nga nh gi khi la m thi như ngươ i vô du ng",1426,"1","2024-12-10T13:32:01.547951Z",1424,0.76,"Neutral","2024-12-10T13:32:01.547951Z"
"Ngô_quang trường đầu_tiên cũng tuyên_bố hùng_hồn lắm nhưng cuối_cùng trước cái sống và cái chết cũng đều cắp đít chạy trước",1427,"1","2024-12-10T13:32:03.918565Z",1425,2.063,"Neutral","2024-12-10T13:32:03.918565Z"
"Chắc huy_động xe phóng tên_lửa cachusa nhìu lắm đây Phóng như mưa ai chịu nổi một tiểu_đội_trưởng thuộc sư_đoàn 86 trả_lời báo trí",1428,"1","2024-12-10T13:32:05.398698Z",1426,1.16,"Neutral","2024-12-10T13:32:05.398698Z"
"Mỗi lời bác dạy đều rất sâu_sắc thật tự_hào khi Việt_Nam_ta có bác và QĐND Việt_Nam tự_hào mang trong mình dòng máu Việt_Nam con lạc cháu rồng",1429,"1","2024-12-10T13:32:08.938937Z",1427,3.221,"Proud","2024-12-10T13:32:08.938937Z"
"quá hay bố mình chống Pháp còn anh mình đánh Mỹ hai thế_hệ đã chiến_thắng bọn Pháp và Mỹ",1430,"1","2024-12-10T13:32:12.092715Z",1428,2.85,"Proud","2024-12-10T13:32:12.092715Z"
"Toi su 312 cung duoc bo sungvao thanh",1431,"1","2024-12-10T13:32:13.129576Z",1429,0.739,"Neutral","2024-12-10T13:32:13.129576Z"
"Khả_năng có một gò Đống Đa 2",1432,"1","2024-12-10T13:32:14.361174Z",1430,0.767,"Neutral","2024-12-10T13:32:14.361174Z"
"Đúng Mình ít nói cái này là để giữ ổn_định hoà_bình thôi",1433,"1","2024-12-10T13:32:20.205885Z",1431,5.538,"Neutral","2024-12-10T13:32:20.205885Z"
"Bố cháu là ng anh của tôi 320",1434,"1","2024-12-10T13:32:24.498453Z",1432,3.977,"Proud","2024-12-10T13:32:24.498453Z"
"Ông em còn bị tra_tấn dã_man và tử_hình cả ông cố và ông nội",1435,"1","2024-12-10T13:32:27.896275Z",1433,3.099,"Sad","2024-12-10T13:32:27.896275Z"
"Môn lịch_sử nêm cho xem phim này để nâng cao lòng yêu nước và biết được giá_trị của độc_lập tự_do ngày hôm_nay red_heart red_heart red_heart",1436,"1","2024-12-10T13:32:30.730152Z",1434,2.529,"Thankful","2024-12-10T13:32:30.730152Z"
"Nghe và ngắm nhìn và sống dung với lịch_sử spiral_calendar tear off_calendar calendar spiral_calendar tear off_calendar calendar spiral_calendar tear off_calendar calendar spiral_calendar tear off_calendar calendar spiral_calendar spiral_calendar calendar tear off_calendar",1437,"1","2024-12-10T13:32:45.074927Z",1435,14.012,"Neutral","2024-12-10T13:32:45.074927Z"
"Ước gì người Việt_Nam không đánh thuê cho mỹ thì đâu có cảnh thương_vong nhiều như_vậy",1438,"1","2024-12-10T13:32:50.902004Z",1436,5.508,"Sad","2024-12-10T13:32:50.902004Z"
"Thật khâm_phục các anh_hùng đã làm_nên những đều kỳ_tích",1439,"1","2024-12-10T13:32:52.816992Z",1437,1.612,"Thankful","2024-12-10T13:32:52.816992Z"
"mấy tên gốc Việt máu Trần_Ích Tắc luôn khoe 3Que anh_dũng hơn Lê_Chiêu_Thống",1440,"1","2024-12-10T13:32:54.622604Z",1438,1.503,"Neutral","2024-12-10T13:32:54.622604Z"
"Hay lắm quân_đội nhân_dân Việt_Nam",1441,"1","2024-12-10T13:32:57.363203Z",1439,2.427,"Proud","2024-12-10T13:32:57.363203Z"
"Mỹ kiểu May quá rút kịp_thời chứ không lại thành Điện_Biên_Phủ thứ 2",1442,"1","2024-12-10T13:33:47.970965Z",1440,50.294,"Neutral","2024-12-10T13:33:47.970965Z"
"xuasaigon4665 Nói bảo_kê cho có vẻ nhà giàu chứ nói triều cống lại nhảy_dựng lên Trong khi bản_chất cũng là cống_nạp và bị chia_cắt làm 2 Còn VN nói luôn là bị thằng trung quốc cướp chứ có cho đâu Lần nào ra quốc_tế VN cũng nói bị cướp chứ có như Hàn_Triều im_lặng dâng cống đâu",1443,"1","2024-12-10T13:33:50.540887Z",1441,2.265,"Neutral","2024-12-10T13:33:50.540887Z"
